word,meaning,example
I’m responsible for,Chịu trách nhiệm,I’m responsible for making sure that our projects come in on schedule and within budget.
My job involves,Liên quan,My job involves managing my customers’ money effectively and profitably.
I develop,Phát triển,I develop websites for my clients.
My main responsibility,Nhiệm vụ chính,My main responsibility is to promote new products ahead of their launch.
I’m in charge of,Phụ trách,I’m in charge of designing new building for our clients.
My job entails,Đòi hỏi,My job entails organizing my boss’s affairs.
I oversee,Giám sát,I oversee a team of 250 builders and twenty administrative staff.